Bedrijfsnaam;Adres;Postcode;Woonplaats;Website
Van Dijk V.O.F.;Voluptatibuspark 135;8553 TX;Enschede;http://www.van-dijk-vof.com
Hypotheker Van den Berg  Financiele Dienstverlening V.O.F.;Etdijk 223;5272 MS;Arnhem;https://www.hypotheker-van-den-berg--financiele-dienstverlening-vof.net
Financieel Adviesbureau Van der Meer NV;Eum Park 93;9051 WB;Rotterdam;http://www.financieel-adviesbureau-van-der-meer-nv.amsterdam
Hypotheek Visie Bakker Advies en Bemiddeling BV;Vitaestraat 328;5834 NK;Zaanstad;https://www.hypotheek-visie-bakker-advies-en-bemiddeling-bv.net
Hypotheekshop De Groot Adviesgroep BV;Temporibuspark 27;0553 GV;Alkmaar;https://www.hypotheekshop-de-groot-adviesgroep-bv.amsterdam
Smit Combinatie;Etdijk 360;7281 TP;Westland;https://www.smit-combinatie.net
Jansen Adviesgroep en Zonen;Consequunturdijk 411;2439 HF;Zaanstad;http://www.jansen-adviesgroep-en-zonen.net
Hypotheker Hendriks;Utgracht 317;2506 QS;Maastricht;http://www.hypotheker-hendriks.com
Hypotheekshop Visser;Qui Park 129;6967 LZ;Breda;https://www.hypotheekshop-visser.nl
Hypotheek Visie Smits NV;Voluptasplein 96;5613 YF;Venlo;https://www.hypotheek-visie-smits-nv.amsterdam
